{
  "$schema": "http://json-schema.org/draft-07/schema#",
  "title": "OPAL state.json Schema",
  "description": "state-tool이 관리하는 파이프라인 현황판 JSON — 파이프라인 현황(rows/상태/다음 액션)의 단일 SSOT(094). STATE.md는 이 값을 파생 렌더하지 않는 저널(의사결정 로그/블로커)이며, 조회는 `state-tool show`로 일원화된다. PLAN §2.2 G-1~G-4.",
  "type": "object",
  "required": [
    "task_id",
    "skill",
    "mode",
    "schema_version",
    "created_at",
    "updated_at",
    "current_status",
    "rows"
  ],
  "additionalProperties": false,
  "properties": {
    "task_id": {
      "type": "string",
      "pattern": "^[0-9]{3}-[0-9]{6}-[a-z]+-.*$",
      "description": "태스크 폴더명 (예: 134-260501-opp-pipeline-state-tool)"
    },
    "skill": {
      "enum": [
        "opp",
        "opd",
        "opds",
        "opdw",
        "opwt",
        "opgc",
        "oppd",
        "opsdd",
        "oppl",
        "opdd"
      ],
      "description": "오케스트레이터 스킬 약어 — opal-pilot-* 10종 (070 R-8: opdd 드리프트 정정)"
    },
    "mode": {
      "enum": [
        "interactive",
        "semi-agentic",
        "agentic"
      ],
      "description": "OPAL 실행 모드 — 3-way (interactive/semi-agentic/agentic). 누락·비문자·enum 밖 값은 validate 위반이며 effective mode는 interactive fail-closed로 해석한다."
    },
    "schema_version": {
      "enum": [
        "1.0",
        "1.1",
        "1.2"
      ],
      "description": "스키마 버전 — 1.0(레거시·key 없음) / 1.1(key·conditional 지원) / 1.2(run_log 로그 계약 블록 보유) 병행 허용 (070 R-3, 123 T05). 1.2는 run_log 필수, 1.0/1.1은 run_log 부재이며 자동 승격·강등을 하지 않는다(C-3)."
    },
    "created_at": {
      "type": "string",
      "pattern": "^\\d{4}-\\d{2}-\\d{2} \\d{2}:\\d{2}(:\\d{2})?$",
      "description": "state.json 최초 생성 시점 (KST YYYY-MM-DD HH:mm[:ss] — 초는 선택. 103 R-19 이전 기록은 분 해상도)"
    },
    "updated_at": {
      "type": "string",
      "pattern": "^\\d{4}-\\d{2}-\\d{2} \\d{2}:\\d{2}(:\\d{2})?$",
      "description": "마지막 갱신 시점 (KST YYYY-MM-DD HH:mm[:ss] — 초는 선택. 103 R-19 이전 기록은 분 해상도)"
    },
    "current_status": {
      "enum": [
        "in_progress",
        "done",
        "blocked",
        "additional_work",
        "additional_work_done",
        "completed_unmerged"
      ],
      "description": "태스크 전체 상태 — §2.11 G-7 전이 그래프 참조. completed_unmerged는 명시적 close.final 행 mark가 확정하는 완료 상태로, 허브 MEMORY 귀속(finalize-attribution) 전임을 뜻한다. close.final이 없는 legacy 단일 CLOSE pipeline은 CLOSE 마지막 행 mark를 하위호환 final로 인정한다(118 D-4b/AC-4, 136 W-2)"
    },
    "rows": {
      "type": "array",
      "minItems": 1,
      "description": "파이프라인 현황판 행 목록 — row_id 1-based 단조 증가. SSOT는 이 필드이며, 조회는 `state-tool show`로 렌더한다(094).",
      "items": {
        "type": "object",
        "required": [
          "row_id",
          "stage",
          "item",
          "status",
          "status_label",
          "timestamp"
        ],
        "additionalProperties": false,
        "properties": {
          "row_id": {
            "type": "integer",
            "minimum": 1,
            "description": "행 번호 (1-based, 단조 증가 — add-row 시 재정렬)"
          },
          "stage": {
            "enum": [
              "TASK",
              "ANALYSIS",
              "PLAN",
              "EXECUTE",
              "TEST",
              "WIREFRAME",
              "QA",
              "SPEC",
              "REVIEW",
              "DESIGN",
              "VERIFY",
              "SCAN",
              "CHECK",
              "REPORT",
              "WBS",
              "CLOSE",
              "DICT",
              "MODEL",
              "DDL/MIGRATION"
            ],
            "description": "단계명 — opal-pilot SKILL.md 합집합 19종 (G-3, 070 R-8: opdd DICT/MODEL/DDL·MIGRATION 추가)"
          },
          "item": {
            "type": "string",
            "minLength": 1,
            "description": "행 항목명. 표준 항목(STANDARD_ITEMS) 또는 산출물명 자유 string"
          },
          "status": {
            "enum": [
              "pending",
              "in_progress",
              "done",
              "failed",
              "na"
            ],
            "description": "행 상태 enum (T-2) — status_label과 정합 필수"
          },
          "status_label": {
            "enum": [
              "⬜",
              "🔄",
              "✅",
              "❌",
              "-"
            ],
            "description": "행 상태 이모지 (T-2) — status와 정합 필수"
          },
          "timestamp": {
            "oneOf": [
              {
                "type": "string",
                "pattern": "^\\d{4}-\\d{2}-\\d{2} \\d{2}:\\d{2}(:\\d{2})?$"
              },
              {
                "type": "null"
              }
            ],
            "description": "행 갱신 시점 (KST YYYY-MM-DD HH:mm[:ss] — 초는 선택). pending 행은 null 허용, 그 외 상태는 string 필수. 103 R-19 이전 기록은 전건 분 해상도이며 집계는 초 부재를 :00으로 읽는다"
          },
          "owner": {
            "oneOf": [
              {
                "enum": [
                  "PM",
                  "worker",
                  "user",
                  "auto"
                ]
              },
              {
                "type": "null"
              }
            ],
            "description": "갱신 주체 — G-12 참조"
          },
          "note": {
            "oneOf": [
              {
                "type": "string"
              },
              {
                "type": "null"
              }
            ],
            "description": "행 메모 — auto-pass / force / block 이유 등"
          },
          "key": {
            "type": "string",
            "pattern": "^[a-z][a-z0-9_]*\\.[a-z][a-z0-9_]*(_[0-9]+)?$",
            "description": "task-step key (문자 주소) — {stage_slug}.{item_slug} (1.1 신규, 선택 — 070 R-3)"
          },
          "conditional": {
            "type": "boolean",
            "description": "조건부 task-step (예: opdw WIREFRAME 스킵 대상). 순수 메타데이터 — 자동 na 없음 (070 DEC-1)"
          },
          "worker_duration_minutes": {
            "type": "integer",
            "minimum": 0,
            "description": "이 행에서 워커(서브에이전트)가 실제 실행한 시간 — 분 단위 0 이상 정수 (103 R-15, 집계 기준 16-b). 원천은 워커 완료 시 하네스가 반환하는 duration_ms이며, PM이 분으로 환산해 `mark --worker-duration-minutes <n>`으로 전달할 때만 기록된다. **선택 필드** — 미기록 행은 키 자체가 없고(전달하지 않으면 생성하지 않는다), 집계에서 그 몫은 축퇴 규칙에 따라 PM 계열에 전액 귀속된다(집계 기준 16-a). 따라서 이 필드가 없는 기존 태스크는 종전 2계열 수치와 항등이다"
          },
          "gate": {
            "type": "object",
            "required": [
              "artifacts",
              "checklist"
            ],
            "additionalProperties": false,
            "properties": {
              "artifacts": {
                "type": "array",
                "items": {
                  "type": "string"
                }
              },
              "checklist": {
                "type": "array",
                "items": {
                  "type": "string"
                },
                "minItems": 1
              }
            },
            "description": "PM Gate 정의 (091). artifacts=태스크 폴더 기준 상대 경로/글롭 — mark가 존재 검증하여 미충족 시 거부. checklist=PM 판단 항목 — mark stdout으로 주입."
          },
          "worker_duration_unknown": {
            "type": "boolean",
            "description": "103 강제 2단 — 워커 소요 미측정을 PM이 명시 선언했음(--worker-duration-unknown). 선택 필드이며 부재는 「침묵」(미선언)을 뜻한다. CLOSE 게이트가 선언과 침묵을 갈라 판정한다."
          }
        }
      }
    },
    "next_action": {
      "oneOf": [
        {
          "type": "string"
        },
        {
          "type": "null"
        }
      ],
      "description": "파이프라인 다음 액션 파생값 — advance/mark 시 다음 대기 행에서 자동 파생, init/전이 --next-action 오버라이드 가능 (072). 조회: `state-tool show`(094 — STATE.md는 더 이상 이 값을 렌더하지 않는다). 런타임 응답의 transition_action/report_type은 이 값과 rows/current_status에서 파생되며 state.json에는 영속하지 않는다. optional (하위호환)"
    },
    "worktree": {
      "type": "string",
      "description": "worktree 코드 작업본 절대경로. --worktree 지정 시에만 존재하는 optional 필드 — 미지정 태스크의 state.json에는 키 자체가 없다 (092)"
    },
    "run_log": {
      "type": "object",
      "description": "상태 원천의 로그 계약 블록 — docs/run-log/CONTRACT.md §1.4. schema_version 1.2의 필수 블록이며 별도 매니페스트 파일을 만들지 않는다(TRD D-7). 손편집으로 제거하면 스키마 검증 실패이고, 활성 계약인데 기록이 사라지면 legacy로 강등하지 않고 run_log_missing으로 진단한다. optional (1.0/1.1 태스크에는 키 자체가 없다).",
      "required": [
        "contract_version",
        "mode",
        "completion_profile",
        "completion_profile_receipt",
        "active_run_id",
        "status",
        "pending_events"
      ],
      "additionalProperties": false,
      "properties": {
        "contract_version": {
          "type": "string",
          "description": "사건 계약 버전 — 현재 \"1.0\" (CONTRACT §1.4)"
        },
        "mode": {
          "enum": [
            "shadow",
            "active"
          ],
          "description": "기록 모드 — shadow(비차단 병행) / active(완료 게이트 집행)"
        },
        "completion_profile": {
          "enum": [
            "observed_trajectory",
            "observed_terminal",
            "cooperative"
          ],
          "description": "완료 판정 등급 — CONTRACT §1.5 enum 3종. 배정값의 SSOT는 profiles.json이다(§1.6)"
        },
        "completion_profile_receipt": {
          "oneOf": [
            {
              "type": "object",
              "required": [
                "channel_id",
                "adapter_id",
                "adapter_sha256",
                "receipt_sha256"
              ],
              "additionalProperties": false,
              "properties": {
                "channel_id": {
                  "type": "string"
                },
                "adapter_id": {
                  "type": "string"
                },
                "adapter_sha256": {
                  "type": "string"
                },
                "receipt_sha256": {
                  "type": "string"
                }
              }
            },
            {
              "type": "null"
            }
          ],
          "description": "mode=active에 필수인 self-test receipt 고정값. shadow는 null (CONTRACT §1.4·§1.5)"
        },
        "active_run_id": {
          "type": "string",
          "pattern": "^run_[A-Za-z0-9_-]+$",
          "description": "현재 run 식별자 — state-tool init/restart-run이 발급한다"
        },
        "status": {
          "enum": [
            "active",
            "pending",
            "overridden"
          ],
          "description": "계약 블록 상태 — 보관함과 전이 규칙으로만 변경된다. pending은 미전송 사건이 남은 상태, overridden은 사용자 우회 1회가 적용된 상태(CONTRACT §1.4·§2.5)"
        },
        "pending_events": {
          "type": "array",
          "maxItems": 128,
          "description": "미전송 사건 보관함 — 항목은 §1.1 공통 필드를 그대로 갖는 compact 표준 payload다(별도 축약 형식 없음). 항목당 UTF-8 4 KiB, 전체 128건(최악 512 KiB) 상한이며, 일반 admission 한도는 128 − (보관함에 있는 override 사건 수)다.",
          "items": {
            "type": "object"
          }
        },
        "last_report": {
          "oneOf": [
            {
              "type": "object",
              "required": [
                "event_id",
                "report_type",
                "transition_action",
                "user_input_required",
                "at"
              ],
              "additionalProperties": false,
              "properties": {
                "event_id": {
                  "type": "string",
                  "description": "가리키는 pm.report 사건의 event_id — 사건이 SSOT이고 이 포인터는 파생이다"
                },
                "report_type": {
                  "enum": [
                    "progress_report",
                    "decision_request"
                  ]
                },
                "transition_action": {
                  "enum": [
                    "continue",
                    "await_user",
                    "blocked",
                    "complete"
                  ]
                },
                "user_input_required": {
                  "type": "boolean"
                },
                "at": {
                  "type": "string",
                  "description": "가리키는 사건의 timestamp(RFC3339 ms, UTC)"
                }
              }
            },
            {
              "type": "null"
            }
          ],
          "description": "직전 pm.report 사건의 파생 포인터 — CONTRACT §1.4 선택 필드(TASK-147 D-7). Stop hook이 조각을 직접 읽거나 CLI를 추가로 띄우지 않고 판정 입력(report_type/transition_action/user_input_required)을 얻게 하는 유일한 경로다. state-tool log-event --event pm.report가 사건 적재와 같은 원자 쓰기로 갱신하며, admission이 거부되면 갱신하지 않는다(H-2). optional — run_log 블록의 필수 필드는 7종 그대로다(§1.4). 자유 서술(summary·reason)은 이 포인터에 복제하지 않는다(§1.3)."
        }
      }
    },
    "run_id": {
      "type": "string",
      "pattern": "^run-[0-9]{14}-[0-9a-f]{8}$",
      "description": "현재 실행 run 식별자 `run-<UTC YYYYMMDDHHMMSS>-<8자리 hex>`. `state-tool run-start` 발급 시에만 존재하는 optional 필드이며 재호출하면 새 id로 교체된다(현재 run은 항상 1개, 이력 누적 없음). required에는 넣지 않는다 — run_id 없는 기존 state.json이 계속 validate를 통과해야 한다 (131 D8)"
    }
  }
}
