{
  "task_id": "136-260508-opp-pm-gate-convention-auto-check",
  "skill": "opp",
  "mode": "interactive",
  "schema_version": "1.0",
  "created_at": "2026-05-08 14:00",
  "updated_at": "2026-05-08 22:08",
  "current_status": "done",
  "rows": [
    {
      "row_id": 1,
      "stage": "TASK",
      "item": "작업",
      "status": "done",
      "status_label": "✅",
      "timestamp": "2026-05-08 14:00",
      "owner": "PM",
      "note": null
    },
    {
      "row_id": 2,
      "stage": "TASK",
      "item": "TASK.md 생성",
      "status": "done",
      "status_label": "✅",
      "timestamp": "2026-05-08 14:00",
      "owner": "PM",
      "note": null
    },
    {
      "row_id": 3,
      "stage": "TASK",
      "item": "사용자 확인",
      "status": "done",
      "status_label": "✅",
      "timestamp": "2026-05-08 16:34",
      "owner": "user",
      "note": "캡틴 확인: TASK 승인"
    },
    {
      "row_id": 4,
      "stage": "PLAN",
      "item": "작업",
      "status": "done",
      "status_label": "✅",
      "timestamp": "2026-05-08 16:42",
      "owner": "PM",
      "note": null
    },
    {
      "row_id": 5,
      "stage": "PLAN",
      "item": "PLAN.md 생성",
      "status": "done",
      "status_label": "✅",
      "timestamp": "2026-05-08 16:42",
      "owner": "PM",
      "note": null
    },
    {
      "row_id": 6,
      "stage": "PLAN",
      "item": "QA Gate",
      "status": "done",
      "status_label": "✅",
      "timestamp": "2026-05-08 16:44",
      "owner": "PM",
      "note": null
    },
    {
      "row_id": 7,
      "stage": "PLAN",
      "item": "QA-PLAN.md 생성",
      "status": "done",
      "status_label": "✅",
      "timestamp": "2026-05-08 16:44",
      "owner": "PM",
      "note": null
    },
    {
      "row_id": 8,
      "stage": "PLAN",
      "item": "State Gate",
      "status": "done",
      "status_label": "✅",
      "timestamp": "2026-05-08 16:44",
      "owner": "PM",
      "note": null
    },
    {
      "row_id": 9,
      "stage": "PLAN",
      "item": "PM Gate",
      "status": "done",
      "status_label": "✅",
      "timestamp": "2026-05-08 16:45",
      "owner": "PM",
      "note": null
    },
    {
      "row_id": 10,
      "stage": "PLAN",
      "item": "State Gate",
      "status": "done",
      "status_label": "✅",
      "timestamp": "2026-05-08 16:45",
      "owner": "PM",
      "note": null
    },
    {
      "row_id": 11,
      "stage": "PLAN",
      "item": "사용자 확인",
      "status": "done",
      "status_label": "✅",
      "timestamp": "2026-05-08 21:21",
      "owner": "user",
      "note": "캡틴 확인: PLAN (b) 정정 승인"
    },
    {
      "row_id": 12,
      "stage": "EXECUTE",
      "item": "작업",
      "status": "done",
      "status_label": "✅",
      "timestamp": "2026-05-08 21:39",
      "owner": "PM",
      "note": null
    },
    {
      "row_id": 13,
      "stage": "EXECUTE",
      "item": "QA Gate",
      "status": "done",
      "status_label": "✅",
      "timestamp": "2026-05-08 22:05",
      "owner": "PM",
      "note": null
    },
    {
      "row_id": 14,
      "stage": "EXECUTE",
      "item": "QA-EXECUTE.md 생성",
      "status": "done",
      "status_label": "✅",
      "timestamp": "2026-05-08 22:05",
      "owner": "PM",
      "note": null
    },
    {
      "row_id": 15,
      "stage": "EXECUTE",
      "item": "State Gate",
      "status": "done",
      "status_label": "✅",
      "timestamp": "2026-05-08 22:05",
      "owner": "PM",
      "note": null
    },
    {
      "row_id": 16,
      "stage": "EXECUTE",
      "item": "PM Gate",
      "status": "done",
      "status_label": "✅",
      "timestamp": "2026-05-08 22:06",
      "owner": "PM",
      "note": null
    },
    {
      "row_id": 17,
      "stage": "EXECUTE",
      "item": "State Gate",
      "status": "done",
      "status_label": "✅",
      "timestamp": "2026-05-08 22:06",
      "owner": "PM",
      "note": null
    },
    {
      "row_id": 18,
      "stage": "EXECUTE",
      "item": "사용자 확인",
      "status": "done",
      "status_label": "✅",
      "timestamp": "2026-05-08 22:07",
      "owner": "user",
      "note": "캡틴 확인: EXECUTE 완료, CLOSE 진입 승인"
    },
    {
      "row_id": 19,
      "stage": "CLOSE",
      "item": "DONE.md 생성",
      "status": "done",
      "status_label": "✅",
      "timestamp": "2026-05-08 22:08",
      "owner": "PM",
      "note": null
    },
    {
      "row_id": 20,
      "stage": "CLOSE",
      "item": "State Gate",
      "status": "done",
      "status_label": "✅",
      "timestamp": "2026-05-08 22:08",
      "owner": "PM",
      "note": null
    }
  ]
}
